{
  "$schema": "https://docs.eidos.space/schemas/extension-manifest.schema.json",
  "manifestVersion": 1,
  "publisher": "example",
  "name": "markdown-task-counter",
  "displayName": "Markdown Task Counter",
  "description": "Count open and completed tasks in a Markdown file.",
  "version": "0.1.0",
  "engines": {
    "eidos": ">=0.33.0"
  },
  "entrypoints": {
    "worker": "src/extension.ts"
  },
  "contributes": {
    "commands": [
      {
        "id": "example.markdown-task-counter.count-tasks",
        "title": "Count Markdown tasks"
      }
    ],
    "menus": {
      "files/context": [
        {
          "command": "example.markdown-task-counter.count-tasks",
          "when": "resourceExtname == .md"
        }
      ]
    }
  },
  "permissions": {
    "files": {
      "read": ["**/*.md"],
      "write": []
    },
    "network": []
  }
}
